{
  "$schema": "https://json-schema.org/draft/2020-12/schema",
  "$id": "https://fast-react.local/schemas/benchmark-manifest.schema.json",
  "title": "Fast React benchmark manifest",
  "type": "object",
  "additionalProperties": false,
  "required": [
    "schemaVersion",
    "kind",
    "manifestId",
    "description",
    "timingDataPolicy",
    "requiredScenarioIds",
    "conformanceGates",
    "scenarios"
  ],
  "properties": {
    "schemaVersion": {
      "const": 1
    },
    "kind": {
      "const": "fast-react-benchmark-manifest"
    },
    "manifestId": {
      "type": "string",
      "minLength": 1
    },
    "description": {
      "type": "string",
      "minLength": 1
    },
    "timingDataPolicy": {
      "const": "diagnostic-until-compatible"
    },
    "requiredScenarioIds": {
      "type": "array",
      "minItems": 1,
      "items": {
        "type": "string",
        "minLength": 1
      },
      "uniqueItems": true
    },
    "conformanceGates": {
      "type": "array",
      "minItems": 1,
      "items": {
        "$ref": "#/$defs/conformanceGate"
      }
    },
    "milestones": {
      "type": "array",
      "minItems": 1,
      "items": {
        "$ref": "#/$defs/milestone"
      }
    },
    "scenarios": {
      "type": "array",
      "minItems": 1,
      "items": {
        "$ref": "#/$defs/scenario"
      }
    }
  },
  "$defs": {
    "compatibilityStatus": {
      "enum": [
        "blocked-by-conformance",
        "oracle-only",
        "unsupported-placeholder",
        "known-mismatch",
        "matched-but-compatibility-not-claimed",
        "green"
      ]
    },
    "timingStatus": {
      "enum": [
        "not-collected",
        "blocked-by-conformance",
        "diagnostic-only",
        "compared-not-compatible",
        "comparable",
        "noise-bound",
        "regression",
        "improvement"
      ]
    },
    "benchmarkReadinessStatus": {
      "enum": [
        "blocked-by-conformance",
        "diagnostic-admitted",
        "comparable-admitted"
      ]
    },
    "acceptedConformanceGate": {
      "type": "object",
      "additionalProperties": false,
      "required": [
        "id",
        "status",
        "command",
        "admitted",
        "compatibilityClaimed"
      ],
      "properties": {
        "id": {
          "type": "string",
          "minLength": 1
        },
        "status": {
          "enum": [
            "accepted-blocked",
            "accepted-private-partial",
            "accepted-oracle-only",
            "green-admitted"
          ]
        },
        "command": {
          "type": "string",
          "minLength": 1
        },
        "admitted": {
          "type": "boolean"
        },
        "compatibilityClaimed": {
          "type": "boolean"
        },
        "notes": {
          "type": "string",
          "minLength": 1
        }
      }
    },
    "conformanceGate": {
      "type": "object",
      "additionalProperties": false,
      "required": ["id", "artifact", "requiredClaims"],
      "properties": {
        "id": {
          "type": "string",
          "minLength": 1
        },
        "artifact": {
          "type": "string",
          "minLength": 1
        },
        "requiredClaims": {
          "type": "array",
          "minItems": 1,
          "items": {
            "enum": [
              "compatibilityClaimed",
              "fastReactBehaviorCompatible",
              "fullDualRunOracleExists"
            ]
          },
          "uniqueItems": true
        },
        "acceptedGate": {
          "$ref": "#/$defs/acceptedConformanceGate"
        }
      }
    },
    "milestone": {
      "type": "object",
      "additionalProperties": false,
      "required": [
        "id",
        "description",
        "scenarioIds",
        "conformanceGateIds",
        "compatibilityStatus",
        "timingStatus",
        "benchmarkReadinessStatus",
        "blockedReason"
      ],
      "properties": {
        "id": {
          "type": "string",
          "minLength": 1
        },
        "description": {
          "type": "string",
          "minLength": 1
        },
        "scenarioIds": {
          "type": "array",
          "minItems": 1,
          "items": {
            "type": "string",
            "minLength": 1
          },
          "uniqueItems": true
        },
        "conformanceGateIds": {
          "type": "array",
          "minItems": 1,
          "items": {
            "type": "string",
            "minLength": 1
          },
          "uniqueItems": true
        },
        "compatibilityStatus": {
          "$ref": "#/$defs/compatibilityStatus"
        },
        "timingStatus": {
          "$ref": "#/$defs/timingStatus"
        },
        "benchmarkReadinessStatus": {
          "$ref": "#/$defs/benchmarkReadinessStatus"
        },
        "blockedReason": {
          "type": "string",
          "minLength": 1
        }
      }
    },
    "scenario": {
      "type": "object",
      "additionalProperties": false,
      "required": [
        "id",
        "area",
        "entrypoints",
        "conformanceGateIds",
        "compatibilityStatus",
        "timingStatus",
        "timingDataPolicy",
        "blockedReason"
      ],
      "properties": {
        "id": {
          "type": "string",
          "minLength": 1
        },
        "area": {
          "type": "string",
          "minLength": 1
        },
        "entrypoints": {
          "type": "array",
          "minItems": 1,
          "items": {
            "type": "string",
            "minLength": 1
          }
        },
        "conformanceGateIds": {
          "type": "array",
          "minItems": 1,
          "items": {
            "type": "string",
            "minLength": 1
          },
          "uniqueItems": true
        },
        "compatibilityStatus": {
          "$ref": "#/$defs/compatibilityStatus"
        },
        "timingStatus": {
          "$ref": "#/$defs/timingStatus"
        },
        "timingDataPolicy": {
          "const": "diagnostic-until-compatible"
        },
        "blockedReason": {
          "type": "string",
          "minLength": 1
        }
      }
    }
  }
}
